<?xml version="1.0" encoding="utf-8" ?>
<users xmlns:xsi="http://www.w3.org/2001/XMLSchema-instance" xsi:noNamespaceSchemaLocation="users.xsd">
    <user type="client" id="10024">
        <name title="Mr">
            <fname>Amit</fname>
            <lname>Deka</lname>
        </name>
        <email>adamitdeka@gmail.com</email>
        <username>adamitdeka03</username>
        <password>client1</password>
        <phone>1236547890</phone>
        <country>Canada</country>
    </user>
    <user type="staff" id="20056">
        <name title="Mr">
            <fname>Mark</fname>
            <lname>Wilson</lname>
        </name>
        <email>markwilson@abc.com</email>
        <username>abcmark123</username>
        <password>staff1</password>
        <phone>4568562355</phone>
        <country>USA</country>
    </user>
    <user type="client" id="10025">
        <name title="Mr">
            <fname>Sahil</fname>
            <lname>Mangla</lname>
        </name>
        <email>sahilmangla@gmail.com</email>
        <username>smmangla</username>
        <password>client2</password>
        <phone>4568791234</phone>
        <country>Canada</country>
    </user>
</users>